{
    "$id": "EtK5g3YBaExiY2JD4o95xvmDyktS6IlqeMYC202_xA88",
    "$schema": "http://json-schema.org/draft-07/schema#",
    "properties": {
        "credentialStatus": {
            "properties": {
                "id": {
                    "type": "string"
                },
                "type": {
                    "type": "string"
                }
            },
            "required": [
                "id"
            ],
            "type": "object"
        },
        "credentialSubject": {
            "additionalProperties": false,
            "properties": {
                "LEI": {
                    "type": "string"
                }
            },
            "required": [
                "LEI"
            ],
            "type": "object"
        },
        "issuanceDate": {
            "format": "date-time",
            "type": "string"
        },
        "issuer": {
            "type": "string"
        },
        "type": {
            "type": "array"
        }
    },
    "required": [
        "type",
        "issuer",
        "issuanceDate",
        "credentialSubject",
        "credentialStatus"
    ],
    "type": "object"
}